{
  "schema_version": "1.0.0",
  "project_id": "cold_war_curtain",
  "project_root": "D:\\HOI4 Mods\\cold_war_curtain",
  "platform": "windows",
  "wizard": {
    "current_step": "ready",
    "completed_steps": [
      "welcome",
      "chatgpt_sign_in",
      "description",
      "identity",
      "scan",
      "review",
      "environments",
      "components",
      "workflows",
      "3d",
      "mcp",
      "git",
      "dry_run",
      "install",
      "ready"
    ],
    "draft_values": {}
  },
  "preferences": {
    "source_mode": "pinned_commit",
    "telemetry": false
  },
  "codex": {
    "integration": "codex_app_server",
    "auth_mode": "chatgpt",
    "auth_status": "signed_in",
    "analysis_required": true,
    "analysis_status": "confirmed",
    "last_error": null,
    "account_values_persisted": false
  },
  "ai": {
    "provider": "codex",
    "model": "gpt-5.6-luna",
    "reasoning_effort": "xhigh",
    "optimization_profile": "Codex setup analysis"
  },
  "coding_environments": {
    "primary": "codex",
    "additional": ["cursor"]
  },
  "portrait_pipeline": {
    "enabled": false,
    "provider": "disabled",
    "provider_status": "not_selected",
    "workflow_repository": "https://github.com/klimPaskov/comfyui-hoi4-portraits",
    "workflow_branch": "codex/portrait-pipeline",
    "workflow_commit": "b47222a77f2f6454704530865aa1441fad48bdd3",
    "preferred_workflow": "source",
    "local_comfyui_root": "",
    "local_server_url": "http://127.0.0.1:8188",
    "runpod_url": "",
    "runpod_workspace": "/workspace/comfyui-hoi4-portraits",
    "mcp_registered": false
  },
  "credential_references": [
    {
      "name": "MESHY_API_KEY",
      "provider": "windows_credential_manager",
      "reference": "credential://meshy_api_key/default"
    }
  ]
}
